{
  "schemaVersion": "1.3.0",
  "engineVersion": "0.4.0",
  "scenario": {
    "schemaVersion": "1.3.0",
    "id": "threat-ends",
    "name": "Effect-triggered threat termination safety fixture",
    "seed": 77,
    "pulseMs": 100,
    "maxTicks": 5,
    "map": {
      "width": 10,
      "height": 10
    },
    "threat": {
      "active": true,
      "severity": 0.9,
      "immediacy": 1,
      "retreatAvailable": true,
      "threatenedActorIds": [
        "defender"
      ]
    },
    "rules": {
      "physics": {
        "enabled": true,
        "interruptMargin": 0.15,
        "tempoNoise": 0,
        "contactNoise": 0,
        "recoveryPerPulse": 0.03,
        "impairmentRecoveryPerPulse": 0.003,
        "separationScaleM": 0.1,
        "neutralizationThreshold": 0.55
      }
    },
    "objectives": [
      {
        "id": "end-threat",
        "kind": "neutralize-side",
        "side": "threat"
      }
    ],
    "terminalConditions": [
      {
        "kind": "side-neutralized",
        "side": "threat"
      }
    ],
    "actors": [
      {
        "id": "aggressor",
        "side": "threat",
        "position": {
          "x": 5.8,
          "y": 5
        },
        "facingDegrees": 180,
        "visionRange": 10,
        "visionArcDegrees": 180,
        "movementSpeed": 1.2,
        "massKg": 70,
        "radiusM": 0.3,
        "skill": 0.5,
        "balance": 0.6,
        "guard": 0.3,
        "mobility": 0.75,
        "surprise": 0,
        "reachM": 0.8,
        "protection": 0,
        "stance": "neutral",
        "readiness": 0.4,
        "stamina": 0.9,
        "resolve": 0.5,
        "threatened": true,
        "policyId": "safety-first"
      },
      {
        "id": "defender",
        "side": "protected",
        "position": {
          "x": 5,
          "y": 5
        },
        "facingDegrees": 0,
        "visionRange": 10,
        "visionArcDegrees": 180,
        "movementSpeed": 1.6,
        "massKg": 80,
        "radiusM": 0.3,
        "skill": 0.9,
        "balance": 0.9,
        "guard": 0.7,
        "mobility": 0.95,
        "surprise": 0.9,
        "reachM": 1,
        "protection": 0.1,
        "stance": "committed",
        "readiness": 0.95,
        "stamina": 1,
        "resolve": 0.9,
        "threatened": true,
        "policyId": "random-valid"
      }
    ]
  },
  "initialState": {
    "schemaVersion": "1.3.0",
    "scenarioId": "threat-ends",
    "tick": 0,
    "elapsedMs": 0,
    "threatActive": true,
    "done": false,
    "environment": {
      "ambientLight": 1,
      "ambientNoise": 0,
      "visibilityScale": 1
    },
    "randomStreams": {
      "sensing": {
        "state": "999c4e27eeb7be13",
        "increment": "0000000000000003",
        "draws": 0
      },
      "movement": {
        "state": "4a40368287e2bc6f",
        "increment": "0000000000000005",
        "draws": 0
      },
      "contact": {
        "state": "fae41edd210dbacb",
        "increment": "0000000000000007",
        "draws": 0
      },
      "morale": {
        "state": "ab880737ba38b927",
        "increment": "0000000000000009",
        "draws": 0
      },
      "policy": {
        "state": "5c2bef925363b783",
        "increment": "000000000000000b",
        "draws": 0
      }
    },
    "objectiveProgress": {
      "end-threat": false
    },
    "squads": [],
    "actors": [
      {
        "id": "aggressor",
        "side": "threat",
        "position": {
          "x": 5.8,
          "y": 5
        },
        "facingDegrees": 180,
        "visionRange": 10,
        "visionArcDegrees": 180,
        "movementSpeed": 1.2,
        "massKg": 70,
        "radiusM": 0.3,
        "skill": 0.5,
        "balance": 0.6,
        "guard": 0.3,
        "mobility": 0.75,
        "surprise": 0,
        "reachM": 0.8,
        "protection": 0,
        "stance": "neutral",
        "readiness": 0.4,
        "stamina": 0.9,
        "resolve": 0.5,
        "threatened": true,
        "policyId": "safety-first",
        "active": true,
        "intent": "observe",
        "shock": 0,
        "impairment": 0,
        "disruption": 0,
        "recoveryTicks": 0,
        "neutralized": false,
        "fear": 0,
        "moraleState": "steady",
        "escaped": false,
        "awareness": 0.5,
        "memoryActorIds": [],
        "memoryAges": {},
        "toolReady": 0,
        "toolAvailable": false,
        "engagementHeadroom": 0
      },
      {
        "id": "defender",
        "side": "protected",
        "position": {
          "x": 5,
          "y": 5
        },
        "facingDegrees": 0,
        "visionRange": 10,
        "visionArcDegrees": 180,
        "movementSpeed": 1.6,
        "massKg": 80,
        "radiusM": 0.3,
        "skill": 0.9,
        "balance": 0.9,
        "guard": 0.7,
        "mobility": 0.95,
        "surprise": 0.9,
        "reachM": 1,
        "protection": 0.1,
        "stance": "committed",
        "readiness": 0.95,
        "stamina": 1,
        "resolve": 0.9,
        "threatened": true,
        "policyId": "random-valid",
        "active": true,
        "intent": "observe",
        "shock": 0,
        "impairment": 0,
        "disruption": 0,
        "recoveryTicks": 0,
        "neutralized": false,
        "fear": 0,
        "moraleState": "steady",
        "escaped": false,
        "awareness": 0.5,
        "memoryActorIds": [],
        "memoryAges": {},
        "toolReady": 0,
        "toolAvailable": false,
        "engagementHeadroom": 0
      }
    ]
  },
  "events": [
    {
      "schemaVersion": "1.3.0",
      "sequence": 0,
      "tick": 0,
      "type": "simulation-started",
      "payload": {
        "scenarioId": "threat-ends",
        "seed": 77
      },
      "priorChecksum": "0000000000000000000000000000000000000000000000000000000000000000",
      "checksum": "ef9414ee02eb3ea75c18be82e5266ac3af056660eb5a4252bf745c60e9efa9e6"
    },
    {
      "schemaVersion": "1.3.0",
      "sequence": 1,
      "tick": 1,
      "type": "observation-built",
      "payload": {
        "observerId": "aggressor",
        "visibleActorIds": [
          "defender"
        ],
        "heardActorIds": [],
        "rememberedActorIds": [],
        "uncertainty": 0.058592,
        "rngSamples": []
      },
      "priorChecksum": "ef9414ee02eb3ea75c18be82e5266ac3af056660eb5a4252bf745c60e9efa9e6",
      "checksum": "f0ae8e5527f4b6e588c68e4c98c7f46539e7da4f3b8c86e8efc60f41cbfc8ea6"
    },
    {
      "schemaVersion": "1.3.0",
      "sequence": 2,
      "tick": 1,
      "type": "observation-built",
      "payload": {
        "observerId": "defender",
        "visibleActorIds": [
          "aggressor"
        ],
        "heardActorIds": [],
        "rememberedActorIds": [],
        "uncertainty": 0.058592,
        "rngSamples": []
      },
      "priorChecksum": "f0ae8e5527f4b6e588c68e4c98c7f46539e7da4f3b8c86e8efc60f41cbfc8ea6",
      "checksum": "91e8c9484ca2c85bcc2e5011dcbf187a439bee46b883f4a7141dab2068465ba0"
    },
    {
      "schemaVersion": "1.3.0",
      "sequence": 3,
      "tick": 1,
      "type": "policy-decided",
      "payload": {
        "actorId": "aggressor",
        "policyId": "safety-first",
        "policyVersion": "1.0.0",
        "selected": "withdraw",
        "candidates": [
          {
            "action": "withdraw",
            "eligible": true,
            "score": 0.8,
            "contributions": {
              "safety": 0.8,
              "detectedRisk": 1
            }
          },
          {
            "action": "observe",
            "eligible": true,
            "score": 0.2,
            "contributions": {
              "safety": 0.2
            }
          },
          {
            "action": "commit",
            "eligible": false,
            "score": 0,
            "contributions": {
              "safety": -1
            }
          }
        ],
        "rationale": "Prefer separation and disengagement whenever withdrawal is available.",
        "rngSamples": []
      },
      "priorChecksum": "91e8c9484ca2c85bcc2e5011dcbf187a439bee46b883f4a7141dab2068465ba0",
      "checksum": "62baaacbb1884e32b793cead31cd14f3067da1518e80a0bd59501f62a6d0a34f"
    },
    {
      "schemaVersion": "1.3.0",
      "sequence": 4,
      "tick": 1,
      "type": "intent-resolved",
      "payload": {
        "actorId": "aggressor",
        "selected": "withdraw",
        "stamina": 0.895
      },
      "priorChecksum": "62baaacbb1884e32b793cead31cd14f3067da1518e80a0bd59501f62a6d0a34f",
      "checksum": "f2e78438521147f2f10cda48032a839365ee51c02e6ad7c606cdf4088fa7f240"
    },
    {
      "schemaVersion": "1.3.0",
      "sequence": 5,
      "tick": 1,
      "type": "policy-decided",
      "payload": {
        "actorId": "defender",
        "policyId": "random-valid",
        "policyVersion": "1.0.0",
        "selected": "commit",
        "candidates": [
          {
            "action": "withdraw",
            "eligible": true,
            "score": 0.614491,
            "contributions": {
              "randomSample": 0.614491
            }
          },
          {
            "action": "commit",
            "eligible": true,
            "score": 0.385509,
            "contributions": {
              "randomSample": 0.385509,
              "threatened": 1
            }
          }
        ],
        "rationale": "Select between valid baseline actions using the named policy random stream.",
        "rngSamples": [
          0.385509
        ]
      },
      "priorChecksum": "f2e78438521147f2f10cda48032a839365ee51c02e6ad7c606cdf4088fa7f240",
      "checksum": "ab081f47f1072ec6c2704bc8afffab56964c2e6189e7f5290c0c25a2acf3c51c"
    },
    {
      "schemaVersion": "1.3.0",
      "sequence": 6,
      "tick": 1,
      "type": "intent-resolved",
      "payload": {
        "actorId": "defender",
        "selected": "commit",
        "stamina": 0.98
      },
      "priorChecksum": "ab081f47f1072ec6c2704bc8afffab56964c2e6189e7f5290c0c25a2acf3c51c",